{
  "receipt_version": "2.0",
  "artifact_type": "sofaudit_validation_receipt",
  "receipt_id": "receipt.network_f2.sofaudit-v2",
  "audit": {
    "audit_id": "network_f2",
    "sofaudit_version": "2.0",
    "artifact": {
      "uri": "experiments/paper13/results/audits/network_f2.sofaudit.json",
      "digest": {
        "algorithm": "sha256",
        "value": "62fcca9458d8742d68fa0354b6539c02d9f5601277225f2ac249edbf29bc6147"
      }
    }
  },
  "validator": {
    "validator_id": "sofaudit.semantic-validator.v2",
    "validator_version": "2.0",
    "implementation": {
      "uri": "experiments/paper13/validation/validate_sofaudit_v2.py",
      "digest": {
        "algorithm": "sha256",
        "value": "74b24b9485292d9e475849907abc9cb681ede7eda7743987e2d869121de4908d"
      }
    },
    "receipt_contract": {
      "uri": "schemas/sofaudit/validation-receipt-v2.0.schema.json",
      "digest": {
        "algorithm": "sha256",
        "value": "eca21b885a7ae80b8d306501b4a36118f041a579ee0033a6a311266cd2f4a452"
      }
    }
  },
  "artifact_closure": {
    "artifact_count": 8,
    "ordered_artifacts": [
      {
        "role": "audit",
        "artifact": {
          "uri": "experiments/paper13/results/audits/network_f2.sofaudit.json",
          "digest": {
            "algorithm": "sha256",
            "value": "62fcca9458d8742d68fa0354b6539c02d9f5601277225f2ac249edbf29bc6147"
          }
        }
      },
      {
        "role": "source-audit",
        "artifact": {
          "uri": "experiments/paper13/archive/results/network_f2.sofaudit",
          "digest": {
            "algorithm": "sha256",
            "value": "5292dca6766e10d537e7ed1d4431fb2d761de370c183b88cbe013b54582d40b8"
          }
        }
      },
      {
        "role": "reference-report",
        "artifact": {
          "uri": "experiments/paper13/results/source-reports/reports/network_ref.sofreport.json",
          "digest": {
            "algorithm": "sha256",
            "value": "0ecbebbdfe19d30554efcbe16cc0a4524feb4a3790e1a76c657d6c32a3f85dd1"
          }
        }
      },
      {
        "role": "target-report",
        "artifact": {
          "uri": "experiments/paper13/results/source-reports/reports/network_f2_learned.sofreport.json",
          "digest": {
            "algorithm": "sha256",
            "value": "7f627252a7f6aa3de36c0afa370811ebbe771195b66990d82a00cffbe129f321"
          }
        }
      },
      {
        "role": "reference-report-validation-receipt",
        "artifact": {
          "uri": "experiments/paper13/results/source-reports/receipts/network_ref.validation-receipt.json",
          "digest": {
            "algorithm": "sha256",
            "value": "fdbf090ea3be5b55f68f704f88dc8b65621ddacb0a6503142176fb95fc21ca2c"
          }
        }
      },
      {
        "role": "target-report-validation-receipt",
        "artifact": {
          "uri": "experiments/paper13/results/source-reports/receipts/network_f2_learned.validation-receipt.json",
          "digest": {
            "algorithm": "sha256",
            "value": "e1033be8f049e6e01e56cb8fbfe9f55975787aa8a18086b83a5ac5f8a454c002"
          }
        }
      },
      {
        "role": "audit-profile",
        "artifact": {
          "uri": "schemas/sofaudit/paper13-standard-regime-a-profile-v2.0.json",
          "digest": {
            "algorithm": "sha256",
            "value": "25a59d8f5897620deaa69a660b3160d32df43030b097830a0668c9eb8a5a20ee"
          }
        }
      },
      {
        "role": "coordinate-semantics-registry",
        "artifact": {
          "uri": "schemas/sofaudit/coordinate-semantics-registry-v1.0.json",
          "digest": {
            "algorithm": "sha256",
            "value": "1d2dc24ae56cfb364b02bccf8c0c3068138e6d07682cf4b0561ec75f765c6d48"
          }
        }
      }
    ],
    "closure_digest": {
      "algorithm": "sha256",
      "value": "7b1bd9729e07d02192f707475d95ad191b08a5a3c9970b5745b09b48a64ad660"
    }
  },
  "status": "PASS",
  "checks": [
    {
      "check_id": "alignment-property-recomputation",
      "status": "PASS"
    },
    {
      "check_id": "artifact-digest-closure",
      "status": "PASS"
    },
    {
      "check_id": "claim-certificate-compatibility",
      "status": "PASS"
    },
    {
      "check_id": "comparison-basis-recomputation",
      "status": "PASS"
    },
    {
      "check_id": "guard-coordinate-coupling",
      "status": "PASS"
    },
    {
      "check_id": "role-regime-profile-closure",
      "status": "PASS"
    },
    {
      "check_id": "schema-validation",
      "status": "PASS"
    },
    {
      "check_id": "source-report-receipt-validation",
      "status": "PASS"
    }
  ],
  "negative_boundaries": [
    "This receipt certifies SOFAUDIT v2 protocol conformance and the bound artifact closure; it is not an Object Certificate and does not assign correctness or action."
  ]
}
