{
  "receipt_version": "2.0",
  "artifact_type": "sofaudit_validation_receipt",
  "receipt_id": "receipt.compiler_f1.sofaudit-v2",
  "audit": {
    "audit_id": "compiler_f1",
    "sofaudit_version": "2.0",
    "artifact": {
      "uri": "experiments/paper13/results/audits/compiler_f1.sofaudit.json",
      "digest": {
        "algorithm": "sha256",
        "value": "bbff0eab6b1b23837cf48bb8caeabc885da45d04982b599dadc20d7ab4f15069"
      }
    }
  },
  "validator": {
    "validator_id": "sofaudit.semantic-validator.v2",
    "validator_version": "2.0",
    "implementation": {
      "uri": "experiments/paper13/validation/validate_sofaudit_v2.py",
      "digest": {
        "algorithm": "sha256",
        "value": "74b24b9485292d9e475849907abc9cb681ede7eda7743987e2d869121de4908d"
      }
    },
    "receipt_contract": {
      "uri": "schemas/sofaudit/validation-receipt-v2.0.schema.json",
      "digest": {
        "algorithm": "sha256",
        "value": "eca21b885a7ae80b8d306501b4a36118f041a579ee0033a6a311266cd2f4a452"
      }
    }
  },
  "artifact_closure": {
    "artifact_count": 8,
    "ordered_artifacts": [
      {
        "role": "audit",
        "artifact": {
          "uri": "experiments/paper13/results/audits/compiler_f1.sofaudit.json",
          "digest": {
            "algorithm": "sha256",
            "value": "bbff0eab6b1b23837cf48bb8caeabc885da45d04982b599dadc20d7ab4f15069"
          }
        }
      },
      {
        "role": "source-audit",
        "artifact": {
          "uri": "experiments/paper13/archive/results/compiler_f1.sofaudit",
          "digest": {
            "algorithm": "sha256",
            "value": "071da3f0aee21b38cc69c11466cd00b0762bae32a1e1457da665e5c1e0c574a9"
          }
        }
      },
      {
        "role": "reference-report",
        "artifact": {
          "uri": "experiments/paper13/results/source-reports/reports/compiler_ref.sofreport.json",
          "digest": {
            "algorithm": "sha256",
            "value": "a2c9a85fee12e7d0eb1eb9caf93fdd25b7ec1bdb16c28412bf6f21a1df9bd6f0"
          }
        }
      },
      {
        "role": "target-report",
        "artifact": {
          "uri": "experiments/paper13/results/source-reports/reports/compiler_f1_learned.sofreport.json",
          "digest": {
            "algorithm": "sha256",
            "value": "c8f4a8e17d1100c497587395ba9300815afe92ad1a0b6fdb0282f741d72c7664"
          }
        }
      },
      {
        "role": "reference-report-validation-receipt",
        "artifact": {
          "uri": "experiments/paper13/results/source-reports/receipts/compiler_ref.validation-receipt.json",
          "digest": {
            "algorithm": "sha256",
            "value": "35e915a6aaad51b872242f08568088998fbfbf249528538cad1f418a423e60b5"
          }
        }
      },
      {
        "role": "target-report-validation-receipt",
        "artifact": {
          "uri": "experiments/paper13/results/source-reports/receipts/compiler_f1_learned.validation-receipt.json",
          "digest": {
            "algorithm": "sha256",
            "value": "53cf654481f9a652df0e10790efd46e71bb55278729dd939bf4dd43ac0fbe9ff"
          }
        }
      },
      {
        "role": "audit-profile",
        "artifact": {
          "uri": "schemas/sofaudit/paper13-standard-regime-a-profile-v2.0.json",
          "digest": {
            "algorithm": "sha256",
            "value": "25a59d8f5897620deaa69a660b3160d32df43030b097830a0668c9eb8a5a20ee"
          }
        }
      },
      {
        "role": "coordinate-semantics-registry",
        "artifact": {
          "uri": "schemas/sofaudit/coordinate-semantics-registry-v1.0.json",
          "digest": {
            "algorithm": "sha256",
            "value": "1d2dc24ae56cfb364b02bccf8c0c3068138e6d07682cf4b0561ec75f765c6d48"
          }
        }
      }
    ],
    "closure_digest": {
      "algorithm": "sha256",
      "value": "9c2ff272cc5ed422e5fd274cd809e4e6f2ffb9d9f070419e30adcbd64187447c"
    }
  },
  "status": "PASS",
  "checks": [
    {
      "check_id": "alignment-property-recomputation",
      "status": "PASS"
    },
    {
      "check_id": "artifact-digest-closure",
      "status": "PASS"
    },
    {
      "check_id": "claim-certificate-compatibility",
      "status": "PASS"
    },
    {
      "check_id": "comparison-basis-recomputation",
      "status": "PASS"
    },
    {
      "check_id": "guard-coordinate-coupling",
      "status": "PASS"
    },
    {
      "check_id": "role-regime-profile-closure",
      "status": "PASS"
    },
    {
      "check_id": "schema-validation",
      "status": "PASS"
    },
    {
      "check_id": "source-report-receipt-validation",
      "status": "PASS"
    }
  ],
  "negative_boundaries": [
    "This receipt certifies SOFAUDIT v2 protocol conformance and the bound artifact closure; it is not an Object Certificate and does not assign correctness or action."
  ]
}
