{
  "receipt_version": "2.0",
  "artifact_type": "sofaudit_validation_receipt",
  "receipt_id": "receipt.before_after_gridworld_obstacle.sofaudit-v2",
  "audit": {
    "audit_id": "before_after_gridworld_obstacle",
    "sofaudit_version": "2.0",
    "artifact": {
      "uri": "experiments/paper13/results/audits/before_after_gridworld.sofaudit.json",
      "digest": {
        "algorithm": "sha256",
        "value": "cdf06f2d2731c9e64043331d5c48dfb3d6513ac32f117d786f435a8cfd10726b"
      }
    }
  },
  "validator": {
    "validator_id": "sofaudit.semantic-validator.v2",
    "validator_version": "2.0",
    "implementation": {
      "uri": "experiments/paper13/validation/validate_sofaudit_v2.py",
      "digest": {
        "algorithm": "sha256",
        "value": "74b24b9485292d9e475849907abc9cb681ede7eda7743987e2d869121de4908d"
      }
    },
    "receipt_contract": {
      "uri": "schemas/sofaudit/validation-receipt-v2.0.schema.json",
      "digest": {
        "algorithm": "sha256",
        "value": "eca21b885a7ae80b8d306501b4a36118f041a579ee0033a6a311266cd2f4a452"
      }
    }
  },
  "artifact_closure": {
    "artifact_count": 8,
    "ordered_artifacts": [
      {
        "role": "audit",
        "artifact": {
          "uri": "experiments/paper13/results/audits/before_after_gridworld.sofaudit.json",
          "digest": {
            "algorithm": "sha256",
            "value": "cdf06f2d2731c9e64043331d5c48dfb3d6513ac32f117d786f435a8cfd10726b"
          }
        }
      },
      {
        "role": "source-audit",
        "artifact": {
          "uri": "experiments/paper13/archive/results/before_after_gridworld.sofaudit",
          "digest": {
            "algorithm": "sha256",
            "value": "46c78066978132e2391d81bc73664f61b427bd51980f8aaafe9780cb665d005a"
          }
        }
      },
      {
        "role": "reference-report",
        "artifact": {
          "uri": "experiments/paper13/results/source-reports/reports/gridworld_obs22_before.sofreport.json",
          "digest": {
            "algorithm": "sha256",
            "value": "5502647c983e0641478ea670c02537f94160d6a23f735998cb502888985b83c0"
          }
        }
      },
      {
        "role": "target-report",
        "artifact": {
          "uri": "experiments/paper13/results/source-reports/reports/gridworld_obs00_after.sofreport.json",
          "digest": {
            "algorithm": "sha256",
            "value": "1b331a521298ca992dc04b5f9ae407f04b432ff441363f68926825af901fd4e5"
          }
        }
      },
      {
        "role": "reference-report-validation-receipt",
        "artifact": {
          "uri": "experiments/paper13/results/source-reports/receipts/gridworld_obs22_before.validation-receipt.json",
          "digest": {
            "algorithm": "sha256",
            "value": "33041af73e3943de5e250f8df87727da574a55a957859682ccd68e303882caa6"
          }
        }
      },
      {
        "role": "target-report-validation-receipt",
        "artifact": {
          "uri": "experiments/paper13/results/source-reports/receipts/gridworld_obs00_after.validation-receipt.json",
          "digest": {
            "algorithm": "sha256",
            "value": "8bc794b9b9e1597dbada54471463314bcf9fd34da7e662e149e348f16ef185ab"
          }
        }
      },
      {
        "role": "audit-profile",
        "artifact": {
          "uri": "schemas/sofaudit/paper13-standard-regime-a-profile-v2.0.json",
          "digest": {
            "algorithm": "sha256",
            "value": "25a59d8f5897620deaa69a660b3160d32df43030b097830a0668c9eb8a5a20ee"
          }
        }
      },
      {
        "role": "coordinate-semantics-registry",
        "artifact": {
          "uri": "schemas/sofaudit/coordinate-semantics-registry-v1.0.json",
          "digest": {
            "algorithm": "sha256",
            "value": "1d2dc24ae56cfb364b02bccf8c0c3068138e6d07682cf4b0561ec75f765c6d48"
          }
        }
      }
    ],
    "closure_digest": {
      "algorithm": "sha256",
      "value": "85b6f23e8a34ae8e002cad9f29b9dd2b09609d2d47d6e6278ecd36a2f6bc0f7b"
    }
  },
  "status": "PASS",
  "checks": [
    {
      "check_id": "alignment-property-recomputation",
      "status": "PASS"
    },
    {
      "check_id": "artifact-digest-closure",
      "status": "PASS"
    },
    {
      "check_id": "claim-certificate-compatibility",
      "status": "PASS"
    },
    {
      "check_id": "comparison-basis-recomputation",
      "status": "PASS"
    },
    {
      "check_id": "guard-coordinate-coupling",
      "status": "PASS"
    },
    {
      "check_id": "role-regime-profile-closure",
      "status": "PASS"
    },
    {
      "check_id": "schema-validation",
      "status": "PASS"
    },
    {
      "check_id": "source-report-receipt-validation",
      "status": "PASS"
    }
  ],
  "negative_boundaries": [
    "This receipt certifies SOFAUDIT v2 protocol conformance and the bound artifact closure; it is not an Object Certificate and does not assign correctness or action."
  ]
}
